{
  "$schema": "https://json-schema.org/draft/2020-12/schema",
  "$id": "https://openremote.local/protocol/remote-layout.schema.json",
  "title": "OpenRemote remote layout",
  "type": "object",
  "required": [
    "id",
    "name",
    "layout"
  ],
  "properties": {
    "id": {
      "type": "string"
    },
    "name": {
      "type": "string"
    },
    "category": {
      "type": "string"
    },
    "canvas": {
      "$ref": "#/$defs/canvas"
    },
    "layout": {
      "type": "array",
      "items": {
        "$ref": "#/$defs/control"
      }
    }
  },
  "$defs": {
    "control": {
      "type": "object",
      "required": [
        "type",
        "id"
      ],
      "properties": {
        "id": {
          "type": "string"
        },
        "type": {
          "type": "string",
          "enum": [
            "button",
            "toggle",
            "slider",
            "touchpad",
            "text_input",
            "dpad",
            "grid_buttons",
            "macro_button"
          ]
        },
        "label": {
          "type": "string"
        },
        "command": {
          "type": "string"
        },
        "min": {
          "type": "number"
        },
        "max": {
          "type": "number"
        },
        "step": {
          "type": "number"
        },
        "props": {
          "type": "object",
          "additionalProperties": true
        },
        "frame": {
          "$ref": "#/$defs/frame"
        }
      },
      "additionalProperties": true
    },
    "canvas": {
      "type": "object",
      "properties": {
        "width": {
          "type": "number"
        },
        "height": {
          "type": "number"
        },
        "grid_size": {
          "type": "number"
        },
        "background_color": {
          "type": "string"
        }
      },
      "additionalProperties": false
    },
    "frame": {
      "type": "object",
      "required": [
        "x",
        "y",
        "width",
        "height"
      ],
      "properties": {
        "x": {
          "type": "number"
        },
        "y": {
          "type": "number"
        },
        "width": {
          "type": "number"
        },
        "height": {
          "type": "number"
        }
      },
      "additionalProperties": false
    }
  },
  "additionalProperties": false
}
